{
  "schema": "grasshopper.android-control-acquisition-requirements/v1",
  "contract_id": "TEMPLATE-ACQUISITION-REQUIREMENTS-NOT-LIVE",
  "collection_mode": "TEST_FIXTURE",
  "issued_utc": "2026-10-09T00:32:00Z",
  "expires_utc": "2026-10-09T00:50:00Z",
  "gap_report": {
    "path": "ANDROID_CONTROL_GAP_REPORT_TEMPLATE.json",
    "sha256": "58f0eed6b00df63da5ce604f1bde6ae86a39ffe88af23b3dc02ac257f2643714",
    "bytes": 2306
  },
  "binding": {
    "source_sha": "0000000000000000000000000000000000000000",
    "session_id": "NOT_PROVEN_SESSION"
  },
  "guest_process": {
    "node_identity": "NOT_PROVEN_FIXTURE_NODE",
    "pid": 4242,
    "started_utc": "2026-10-09T00:00:00Z",
    "observed_utc": "2026-10-09T00:31:00Z",
    "fingerprint_sha256": "aaaaaaaaaaaaaaaaaaaaaaaaaaaaaaaaaaaaaaaaaaaaaaaaaaaaaaaaaaaaaaaa"
  },
  "origins": [
    {
      "origin": "workstation",
      "node_identity": "NOT_PROVEN_WORKSTATION",
      "transport": "RFB",
      "session_id": "NOT_PROVEN_SESSION",
      "evidence_sha256": "a49267cdf21261bdf0d8f0008f55afd6475cb36fd16d8a183e16c66f33fa0f76",
      "required_gates": ["delivery", "visible_acknowledgement", "semantic_effect", "reconnect_continuity"]
    },
    {
      "origin": "browser",
      "node_identity": "NOT_PROVEN_BROWSER",
      "transport": "noVNC-websocket",
      "session_id": "NOT_PROVEN_SESSION",
      "evidence_sha256": "9de4835223a6b4f008997b62f897837badafe2b883ecdd302e34cd70b8c3b831",
      "required_gates": ["delivery", "visible_acknowledgement", "semantic_effect", "reconnect_continuity"]
    },
    {
      "origin": "physical_android",
      "node_identity": "NOT_PROVEN_PHYSICAL_ANDROID",
      "transport": "broccoli-rish-observation",
      "session_id": "NOT_PROVEN_SESSION",
      "evidence_sha256": "0d9dc059f0934d8802af7d6e48d04b4e3c21f77d72a2e7bc3f5edad861abb74a",
      "required_gates": ["delivery", "visible_acknowledgement", "semantic_effect", "reconnect_continuity"]
    }
  ],
  "execution_mode": "NON_EXECUTABLE_REQUIREMENTS",
  "collection_authorized": false,
  "live_acceptance": false,
  "r2": "NOT_PROVEN"
}
